{
  "annotation": {
    "annotators": [],
    "failure_modes": [],
    "rationale": null,
    "status": "pending",
    "verdict": null
  },
  "id": "synthetic-heat-pde-only-boundary",
  "origin": {
    "generated_at": "2026-08-24T14:30:00+00:00",
    "identifier": "experiments.adversarial_heat.build_cases",
    "input": "Constructed adversarial candidate for the fully stated heat problem. The PDE residual is zero, but the initial and right boundary conditions fail.",
    "kind": "synthetic",
    "license": "MIT",
    "producer": "PDECert",
    "revision": "f5a45d8f78e29608bee20e97b75fc9f29ced51f9",
    "source_url": "https://github.com/oroikono/PDECert/blob/f5a45d8f78e29608bee20e97b75fc9f29ced51f9/experiments/adversarial_heat.py",
    "version": "0.1.0"
  },
  "output_sha256": "0a807e7e757363bbc5af37c90067137cd97d59679cb346ae5eb0d02d99d7f207"
}
