{
  "annotation": {
    "annotators": [],
    "failure_modes": [],
    "rationale": null,
    "status": "pending",
    "verdict": null
  },
  "id": "qwen3-parametric-heat-01",
  "origin": {
    "generated_at": "2026-08-24T16:29:24.309727+00:00",
    "identifier": "Qwen/Qwen3-1.7B",
    "input": "{\"generation\": {\"do_sample\": false, \"max_new_tokens\": 160}, \"prompt\": \"Solve u_t = k*u_xx for x,t in [0,1] and every k in [0.2,2], with u(x,0)=sin(pi*x) and u(0,t)=u(1,t)=0.\\n\\nReturn one explicit candidate expression for every requested field. Use Python/SymPy syntax with variables x, t, k. You may use pi, E, sin, cos, sinh, cosh, tanh, exp, log, sqrt, Abs, +, -, *, /, **, and parentheses. Do not return an implicit equation, arbitrary function, derivative, integral, code block, or explanation. End with exactly:\\nFINAL u: <expression>\"}",
    "kind": "open_model",
    "license": "Apache-2.0",
    "producer": "Qwen via Transformers",
    "revision": "70d244cc86ccca08cf5af4e1e306ecf908b1ad5e",
    "source_url": "https://huggingface.co/Qwen/Qwen3-1.7B",
    "version": "4.55.4"
  },
  "output_sha256": "bd995a8b8a8d328a798a8401731281f3583086e7bcad122f6879406afe1877e6"
}
