{
  "annotation": {
    "annotators": [],
    "failure_modes": [],
    "rationale": null,
    "status": "pending",
    "verdict": null
  },
  "id": "synthetic-heat-below-tolerance",
  "origin": {
    "generated_at": "2026-08-24T14:30:00+00:00",
    "identifier": "experiments.adversarial_heat.build_cases",
    "input": "Constructed adversarial candidate for the fully stated heat problem. A real error is below tolerance and must not be reported as proved.",
    "kind": "synthetic",
    "license": "MIT",
    "producer": "PDECert",
    "revision": "f5a45d8f78e29608bee20e97b75fc9f29ced51f9",
    "source_url": "https://github.com/oroikono/PDECert/blob/f5a45d8f78e29608bee20e97b75fc9f29ced51f9/experiments/adversarial_heat.py",
    "version": "0.1.0"
  },
  "output_sha256": "0f74ae1641c46664d8e915333f9771778a6166e58be7002f12774e1f740e28f5"
}
